[
  {
    "action": "search",
    "complexity": "Simple",
    "complexity_score": 1.34,
    "component": "billing-web",
    "evidence": [
      {
        "file": "billing-web/src/main/webapp/WEB-INF/views/customers/search.jsp",
        "line": 1,
        "snippet": null
      }
    ],
    "fields_count": 1,
    "file": "billing-web/src/main/webapp/WEB-INF/views/customers/search.jsp",
    "id": "screen:8f683aecfbbcde40",
    "name": "billing-web/src/main/webapp/WEB-INF/views/customers/search.jsp",
    "partial": false,
    "targeted_by": [
      "service:f83e485622850acf"
    ],
    "technology": "jsp"
  },
  {
    "action": null,
    "complexity": "Simple",
    "complexity_score": 1.08,
    "component": "billing-web",
    "evidence": [
      {
        "file": "billing-web/src/main/webapp/WEB-INF/views/home.jsp",
        "line": 1,
        "snippet": null
      }
    ],
    "fields_count": 0,
    "file": "billing-web/src/main/webapp/WEB-INF/views/home.jsp",
    "id": "screen:97d933ecf95c2a5e",
    "name": "billing-web/src/main/webapp/WEB-INF/views/home.jsp",
    "partial": false,
    "targeted_by": [
      "file:ea10d2247b5548e1"
    ],
    "technology": "jsp"
  },
  {
    "action": "${id}/pay",
    "complexity": "Simple",
    "complexity_score": 1.52,
    "component": "billing-web",
    "evidence": [
      {
        "file": "billing-web/src/main/webapp/WEB-INF/views/invoices/detail.jsp",
        "line": 1,
        "snippet": null
      }
    ],
    "fields_count": 2,
    "file": "billing-web/src/main/webapp/WEB-INF/views/invoices/detail.jsp",
    "id": "screen:01e5975666c97869",
    "name": "billing-web/src/main/webapp/WEB-INF/views/invoices/detail.jsp",
    "partial": false,
    "targeted_by": [
      "service:32c0d8031410b4e1"
    ],
    "technology": "jsp"
  },
  {
    "action": null,
    "complexity": "Simple",
    "complexity_score": 1.17,
    "component": "billing-web",
    "evidence": [
      {
        "file": "billing-web/src/main/webapp/WEB-INF/views/invoices/list.jsp",
        "line": 1,
        "snippet": null
      }
    ],
    "fields_count": 0,
    "file": "billing-web/src/main/webapp/WEB-INF/views/invoices/list.jsp",
    "id": "screen:c6a61f35f0d54a46",
    "name": "billing-web/src/main/webapp/WEB-INF/views/invoices/list.jsp",
    "partial": false,
    "targeted_by": [
      "service:fda29992cfe62bf9"
    ],
    "technology": "jsp"
  },
  {
    "action": null,
    "complexity": null,
    "complexity_score": null,
    "component": "billing-web",
    "evidence": [
      {
        "file": "billing-web/src/main/webapp/WEB-INF/views/common/header.jspf",
        "line": 1,
        "snippet": null
      }
    ],
    "fields_count": 0,
    "file": "billing-web/src/main/webapp/WEB-INF/views/common/header.jspf",
    "id": "screen:fe290097d692789b",
    "name": "billing-web/src/main/webapp/WEB-INF/views/common/header.jspf",
    "partial": true,
    "targeted_by": [
      "screen:01e5975666c97869",
      "screen:8f683aecfbbcde40",
      "screen:97d933ecf95c2a5e",
      "screen:c6a61f35f0d54a46"
    ],
    "technology": "jsp"
  }
]
